<?xml version="1.0" standalone="yes"?><!DOCTYPE park SYSTEM "park.dtd">
<park>
	<nameServer>
		<host ip="nirvana.lip6.fr" port="7777"/>
		<ssh/>
		<!--<ssh gate="gate-ia.lip6.fr" dir="workspace/DimaX_SD/" user="ductors" />!-->
	</nameServer>
		
	<network>
		<networkID> remote</networkID>
		<ssh gate="gate-ia.lip6.fr" dir="Dropbox/Boulot/Experimentation/DimaXx_Branch_SD/" user="ductors" />

		<group>
			<groupID> 649</groupID>
			<host ip="finalcut" port="7003" />
			<host ip="heaven" port="7003" />
			<host ip="darkside" port="7003" />
			<host ip="intheflesh" port="7003" />
		</group>
		
		<group>
			<groupID> 649</groupID>
			<host ip="finalcut" port="7003" />
			<host ip="heaven" port="7003" />
			<host ip="darkside" port="7003" />
			<host ip="intheflesh" port="7003" />
		</group>

		<group>
			<groupID> 650</groupID>
			<host ip="ratsalad" port="7003" />
		</group>
	</network>
	
	<network>
		<networkID> local</networkID>
		<ssh/>

		<group>
			<groupID> 600</groupID>
			<host ip="alister.lip6.fr" port="7002" />
			<host ip="fratellis.lip6.fr" port="7003" />
			<host ip="mafalda.lip6.fr" port="7001" />
		</group>
		
		<group>
			<groupID> 649</groupID>
			<host ip="finalcut.lip6.fr" port="7003" />
			<host ip="heaven.lip6.fr" port="7003" />
			<host ip="darkside.lip6.fr" port="7003" />
			<host ip="intheflesh.lip6.fr" port="7003" />
		</group>

		<group>
			<groupID> 650</groupID>
			<host ip="ferdinand.lip6.fr" port="7002" />
			<host ip="fatboyslim.lip6.fr" port="7003" />
			<host ip="ratsalad.lip6.fr" port="7003" />
		</group>
	</network>
	
	<activatedNetworks>
		<networkID> local</networkID>
	</activatedNetworks>
		
	<activatedGroups>
		<groupID> 600</groupID>
	</activatedGroups>
		
</park>
